id;muscle;m_part (list);affected_joints;origin;insertion;function;f_fixed;f_unilateral;f_bilateral;innervation;comment;url_img
1;M. Trapezius ;<li>Pars descendens</li><li>Pars transversa</li><li>Pars ascendens</li>;Samtliga intervertebralleder C1-Th12. Art. Thoracoscapularis. Art. Acromioclavicularis. Art. Sternoclavicularis;Skallbasen, protuberantia occipitalis externa. Processus spinosus C2-C7 via ligamentum nuchae. Processus spinosus Th1-Th12.;Pars descendens:<br>Laterala 1/3 av claviculae.<br><br>Pars transversa:<br>Acromion. Spina scapulae.<br><br>Pars ascendens:<br>Spina scapulae. Basis spina scapulae.;;Pars descendens:<br>Lateralflexion av halsrygg och huvud. Kontralateral rotation av halsrygg och huvud.;Pars descendens:<br>Elevation av skuldran. Utåtrotation av scapulae.<br><br>Pars transversa:<br>Adduktion av scapulae. Utåtrotation av scapulae. Lätt extension av bröstryggskotor Th1-Th12.<br><br>Pars ascendens:<br>Depression av scapulae. Utåtrotation av scapulae. Lätt adduktion av scapulae.;Pars descendens:<br>Extention av halsrygg och huvud. Ökar lordosen i halsryggen. Kompression av halsryggen.;C2-C4 N. Accessorius (XI) Pl. Cervicalis.;Delen blir ofta statiskt överbelastad med värk och ömhet i området. Förkortad muskel kan ge rörelseinskränkningar i halsrygg och huvud vid rotation och lateralflexion. Värk och ömhet orsakas av korta antagonister, ex. pectoralis major. Triggerpunkter ger ofta upphov till huvudvärk som går från nacken upp över örat till tinningen och fram till ögat. ;images/muscles/trapezius.png
2;M. Levator scapula;;Samtliga intervertebralleder i cervicalryggen. Art. Thoracoscapularis. Art. Acromioclavicularis. Art. Sternoclavicularis;Processus transversus C1-C4 (tubercula posteriora).;Angulus superior scapulae;;Lateralflexion av halsrygg och huvud. Ipsilateral rotation av halsrygg och huvud.;Elevation av scapulae. Inåtrotation av scapulae.;Extention av halsrygg och huvud.;C3-C5 N. Dorsalis scapulae Pl. Cervicalis;Muskeln är tvinnad i sitt förlopp vilket ger den en extra elasticitet. Muskeln är ofta inblandad i akuta rörelseinskränkningar som smärttillstånd i nacken.;images/muscles/levator_scapula.png
3;M. Latissimus dorsi;;Art. Humeri. Intervertebralleder Th6-L5. Art. Thoracoscapularis.;Via den thoracolumbala fascian (bindvävsblad) - sacrums crista sacralis mediana. Crista iliaca labium externum. Processus spinosus Th6-L5. Costa 9-12 dorsalt.;Crista tuberculi minoris humeri. Angulus inferior scapulae.;;;Adduktion i art. Humeri. Extention i art. Humeri. Retroflexion i art. Humeri. Inåtrotation i art. Humeri. Horisontalabduktion i art. Humeri. Depression av skuldran. Adduktion av scapulae. Inåtrotation av scapulae. Stabiliserar scapulea mot thoraxväggen. Lateralflexion av bålen. Ipsilateral rotation av bålen.;Extention av bålen. Ökar lordosen i ländryggen.;C6-C8 N. Thoracodorsalis Pl. Brachialis;Påverkar bålrörelser framförallt när art.humeri är flekterad eller abducerad. Sista biten är tvinnad för att öka svikten och elasticiteten i muskeln vid hängande i armarna. Triggerpunkter kan ge smärta ut i armen och ner i handens lillfingersida.;images/muscles/latissimus_dorsi.png
4;M. Rhomboideus major;;Art. Thoracoscapularis. Intervertebrallederna Th1-Th5. Art. Acromioclavicularis. Art. Sternoclavicularis;Processus spinosus Th1-Th5.;Margo medialis scapulae inferiort spina scapulae.;;;Adduktion av scapulae. Elevation av scapulae. Inåtrotation av scapulae. Kontralateral rotation av thorakalkotorna Th1-Th5;;C4-C5 N. Dorsalis scapulae Pl. Cervicalis;Påverkas av hållningsproblem. Triggerpunkter upphov till brännande smärta eller domnande känsla. Bra att töja antagonisten pectoralis major för att undvika statisk överbelastning.;images/muscles/rhomboideus_maj_min.png
5;M. Rhomboideus minor;;Art. Thoracoscapularis. Intervertebrallederna C6-C7. Art. Acromioclavicularis. Art. Sternoclavicularis.;Processus spinosus C6-C7;Margo medialis scapulae superiort basis spina scapulae;;Kontralateral rotation av halsrygg och huvud. Lätt lateralflexion av halsrygg och huvud.;Adduktion av scapulae. Elevation av scapulae. Utåtrotation av scapulae.;;C4-C5 N.Dorsalis scapulae Pl. Cervicalis;Muskeln har ingen avskiljbar gräns mot M. R. major,uppkom av att muskeln har funktioner i halsryggen. I övrigt se kommentar för M. R. Major.;images/muscles/rhomboideus_maj_min.png
6;M. Serratus posterior inferior;;Intervertebralleder Th11-L2. Costovertebralleder Th9-Th12;Via den thoracolumbala fascian på processus spinosus Th11-L2.;Costae 9-12;;;Depression av costa 9-12. Ipsilateral rotation av bålen.  Kontralateral rotation av thorakal och ländryggskotorna Th11-L2.;Accessorisk andningsmuskel (vid expiration). Extention av bålen.;Th9-Th12 Rr. Ventralis Nn. Intercostalis;Smärta kan uppkomma vid forcerad andning eller höjning/sänkning av revbenen.;
7;M. Serratus posterior superior;;;Processus spinosus C6-Th2;Lateralt angulus costae 2-5;;;Höjer costa 2-5. Kontralateral rotation av cervicalrygg.;Extension av bål;Th1-Th4 Nn. Intercostalis;Triggerpunkter ger smärta lokalt och ut i armens baksida och ut i lillfingret. För att att komma åt triggerpunkten måste scapulae först abduceras.;
8;M. Splenius capitis;;;Processus spinosus C3-Th3 cervicalt via lig. Nuchae.;Processus mastoideus. Linea nuchae superior.;;;Lateralflexion av halsryggrad. Ipsilateral rotation av halsryggrad.;Extention av halsryggrad/huvud.;C1-C5 Rr. Dorsales;Visar endast EMG-aktivitet under rotation och extention (dvs. ej vid lateralflexion).;
9;M. Splenius cervicis;;;Lig. Supraspinale. Processus spinosus Th3-Th5;Processus transversus tuberculum posteriora C1-C2;;;Ipsilateral rotation av halsryggrad. Lateralflexion av halsryggrad;Extention av halsryggrad.;C1-C5 Rr. Dorsales;Triggerpunkt ger huvudsakligen värk djupt inne bakom ögat.;
12;M. Iliocostalis - Sacrospinala systemet;<li>M. Iliocostalis cervicis</li><li> M. Iliocostalis thoracis</li><li>M. Iliocostalis lumborium</li>;Lumborum, thoracis, cervicis (längst och mest lateralt);M. Iliocostalis cervicis:<br>Angulus costae 1-6 medialt om fästet för iliocostalis thoracis.<br><br>M. Iliocostalis thoracis:<br>Angulus costae 6-12 medialt om fästet för iliocostalis lumborum.<br><br>M. Iliocostalis lumborium:<br>Crista iliaca (labrium externum). Facies dorsalis ossis sacri. Processus spinosus Th11-L5.;M. Iliocostalis cervicis:<br>Processus transversus C4-C7 (tuberculum posterior).<br><br>M. Iliocostalis thoracis:<br>Angulus costae 1-6.<br><br>M. Iliocostalis lumborium:<br>Angulus costae 6-12.;Sacrospinala systemet: <br>Extention av bål och huvud. Ipsilateral rotation av bål och huvud. Lateralflexion av bål och huvud. Postural funktion.;;;;C1-S3 Rr. Dorsales Nn. Spinales;;images/muscles/iliocostalis.png
13;M. Longissimus - Sacrospinala systemet;<li>M. Longissimus capitis</li><li> M. Longissimus cervicis</li><li>M. Longissimus thoracis</li>;thoracis cervicis, capitis (tjockast);M. Longissimus capitis:<br>Processus transversus Th1-Th2. Processus articularis C4-C7.<br><br>M. Longissimus cervicis:<br>Processus tranvsersus Th3-Th6.<br><br>M. Longissimus thoracis:<br>Facies dorsalis ossis sacri. Crista iliaca labium externum.;M. Longissimus capitis:<br>Processus mastoideus posteriora del.<br><br>M. Longissimus cervicis:<br>Processus tranversus (C5)C6-C7 (tubercula posteriora).<br><br>M. Longissimus thoracis:<br>Fäste mediala stråken: Processus accessorius (L1)L2-L3. Processus transversus Th1-Th12.   Fäste laterala stråken: Processus costarius (L1)L2-L3. Costa 1-12 mellan tuberculum costa och angulus costa.;Sacrospinala systemet: <br>Extention av bål och huvud. Ipsilateral rotation av bål och huvud. Lateralflexion av bål och huvud. Postural funktion.;;;;C1-S3 Rr. Dorsales Nn. Spinales;;images/muscles/longissimus.png
14;M. Spinalis - Sacrospinala systemet;<li>M. Spinalis capitis</li><li> M. Spinalis cervicis</li><li>M. Spinalis thoracis</li>;thoracis, cervicis, capitis (tunnast och mest medialt).;M. Spinalis capitis:<br>Processus spinosus Th1-Th2.<br><br>M. Spinalis cervicis:<br>Processus spinosus C6-C7.<br><br>M. Spinalis thoracis:<br>Processus spinosus Th11-Th12.;M. Spinalis capitis:<br>Os occipitale mellan linea nuchae superior och inferior<br><br>M. Spinalis cervicis:<br>Tuberculum posterior C1. Processus spinosus C2.<br><br>M. Spinalis thoracis:<br>Processus spinosus Th3-Th9.;Sacrospinala systemet: <br>Extention av bål och huvud. Ipsilateral rotation av bål och huvud. Lateralflexion av bål och huvud. Postural funktion.;;;;C1-S3 Rr. Dorsales Nn. Spinales;;images/muscles/spinalis.png
15;Transversospinala systemet;<li>M. Semispinalis capitis, M. Semispinalis cervicis & M. Semispinalis thoracis </li><li>M. Rotatores thoracis, M. Rotatores cervicis & M. Rotatores capitis</li><li>M. Multifidus</li>;;M. Semispinalis capitis:<br>Processus transversus C3-Th6<br><br>M. Semispinalis cervicis:<br>Processus transversus C7-Th4.<br><br>M. Semispinalis thoracis:<br>Processus transversus Th5-Th12.<br><br>M. Multifidus:<br>Facies dorsalis ossis sacri. Processus transversus (accessorius i ländryggen) L5-C6.;M. Semispinalis capitis:<br>Os occipitale mellan linea nuchae superior och inferior.<br><br>M. Semispinalis cervicis:<br>Processus spinosus C2-C7.<br><br>M. Semispinalis thoracis:<br>Processus spinosus Th1-Th6.<br><br>M. Multifidus:<br>Processus spinosus L5-C3.;;;Kontralateral rotation av bål och huvud. Lateralflexion av bål och huvud.;Extention av bål och huvud. Postural funktion.;;Mm. Rotatores:<br>Skillnaden mellan muskelgruppen och M.Multifidus är att förstnämnda endast går till processus spinosus på kotan ovanför.<br><br>M. Multifidus:<br>Triggerpunkter ger smärta lokalt. Triggerpunkter lumbalt kan ge smärta i buken.;images/muscles/transversospinala.png
16;Korta vertikala systemet;<li>Mm. Interspinales</li><li>Mm. Intertransversarii laterale lumborum, Mm. Intertransversarii mediales lumborum, Mm. Intertransversarii thoracis, Mm. Intertransversarii anteriores cervicis & Mm. Intertransversarii posteriores cervicis</li>;;;;Extention av bål och huvud. Lateralflexion av bål och huvud. Sensorisk funktion.;;;;Rami dorsalis nervi spinalis;Mm. Interspinales:<br>Lumborum, thoracis, cervicis, löper mellan processus spinosus C2-S1.<br><br>Mm. Intertransversarii laterale lumborum:<br>Löper mellan processus costarius L1-L5<br><br> Mm. Intertransversarii mediales lumborum:<br>Löper mellan processus accessorius L1-L5<br><br> Mm. Intertransversarii thoracis:<br>Löper mellan processus transversus Th1-Th12.<br><br>Mm. Intertransversarii anteriores cervicis:<br>Löper mellan tuberculum anteriora C1-C7<br><br> Mm. Intertransversarii posteriores cervicis:<br>Löper mellan tuberculum posteriora C1-C7;images/muscles/korta_vertikala.png
17;Mm. Suboccipitalis/Nackrosetten;"<ol style=margin-left:-35px;><li>M. Rectus capitis posterior minor</li><li>M. Rectus capitis posterior major</li><li>M. Rectus capitis lateralis</li><li>M. Obliquus capitis superior</li><li>M. Obliquus capitis inferior</li></ol>";;M. Rectus capitis posterior minor:<br>Tuberculum posterior atlantis.<br><br>M. Rectus capitis posterior major:<br>Processus spinosus C2.<br>M. Rectus capitis lateralis:<br>Processus transversus atlantis.<br><br>M. Obliquus capitis superior:<br>Processus transversus atlantis.<br><br>M. Obliquus capitis inferior:<br>Processus spinosus C2.;M. Rectus capitis posterior minor:<br>Medialt på lineae nuchae inferior.<br><br>M. Rectus capitis posterior major:<br>Inferiort om linea nuchea inferior.<br>M. Rectus capitis lateralis:<br>Os occipitale vertikalt ovanför processus transversus atlantis.<br><br>M. Obliquus capitis superior:<br>Lateralt på linea nuchae inferior.<br><br>M. Obliquus capitis inferior:<br>Processus transversus atlantis.;M. Rectus capitis posterior minor:<br>Extention, ipsilateral rotation, lätt lateralflexion av C0-C1.<br><br>M. Rectus capitis posterior major:<br>Extention, ipsilateral rotation, lätt lateralflexion av C0-C2.<br>M. Rectus capitis lateralis:<br>Lateralflexion C0-C1.<br><br>M. Obliquus capitis superior:<br>Extention, lateralflexion, kontralateral rotation av C0-C1.<br><br>M. Obliquus capitis inferior:<br>Ipsilateralrotation av C1-C2.;;Ipsilateral rotation av huvudet. Lateralflexion av huvudet.;Extention av huvudet.;C1 N. Suboccipitalis;Triggerpunkter ger en diffus smärta som ett band över örat;images/muscles/suboccipitalis.png
18;M. Pectoralis major;<li>Pars clavicularis</li><li>Pars sternocostalis</li><li>Pars abdominalis</li>;Art. Humeri. Art. Thoracoscapularis. Art. Sternoclavicularis. Art. Acromioclavicularis;Pars clavicularis:<br>Claviculaes mediala 1/2.<br><br>Pars sternocostalis:<br>Övergången mellan cartilago costae och sternum i höjd med costae 2-6.<br><br>Pars abdominalis:<br>Via en flik från rectusskidan.;Crista tuberculi majoris humeri;Horisontaladduktion i art. Humeri. Inåtrotation i art. Humeri. Abduktion av scapulae.<br><br>Pars clavicularis:<br>Anteflexion i art. Humeri. Flexion i art. Humeri<br><br>Pars abdominalis:<br>Adduktion i art. Humeri. Depression av scapulae. Accessorisk andningsmuskel vid inspiration.;;;;C5-C8<br><br>Pars clavicularis:<br>C5-C6 N. Pectoralis lateralis Pl. Brachialis.<br><br>Pars sternocostalis:<br>C6-C8 N. Pectoralis lateralis Pl. Brachialis.<br><br>Pars abdominalis:<br>C8-Th1 N. Pectoralis medialis Pl.Brachialis.;Förkortad muskel kan ge upphov till cirkulationsstörningar i armen med domningar och stickningar som följd. Triggerpunkter ger smärta lokalt, ut i armen och till handens lillfingersida. Andra symptom kan vara hjärtarytmier och smärta ut i armen, som vid angina pectoris (kärlkramp).;images/muscles/pectoralis_major.png
19;M. Pectoralis minor;;Art. Thoracoscapularis. Art. Acromioclavicularis. Costovertebralleder 3-5;Costae 3-5 anteriort.;Processus coracoideus scapulae.;Depression av scapulae. Inåtrotation av scapulae. Abduktion av scapulae. Stabiliserar scapulae mot thoraxväggen. Framåttippning av scapulae ( anterior tilt);Accessorisk andningsmuskel vid inspiration.;;;C(6)7-Th1 N. Pectoralis medialis Pl. Brachialis;Om spänd eller förkortad, ge entrapment av kärl så att armen somnar. Svaghet och smärta i armarna vid arbete med armarna ovanför huvudhöjd kan ibland härledas. Triggerpunkter i muskeln kan ge smärtor i bröstregionen och stimulera angina pectoris.;images/muscles/pectoralis_minor.png
20;M. Subclavius;;Art. Sternoclavicularis. Art. Acromioclavicularis. Art. Thoracoscapularis;Cartilago costae mellan manubrium sterni och costae 1.;Undersidan på claviculaes mellersta  tredjedel;Stabiliserar art. Sternoclavicularis. Depression av claviculae. Depressions av scapulae.;;;;C5-C6 N. Subclavius Pl. Brachialis;Läget nära till nerver och kärl, gör att om den blir spänd kan den ge entrapment  med dominingar och smärta ut i armen som följd;images/muscles/subclavius.png
21;M. Serratus anterior;;Art. Thoracoscapularis. Costovertebrallederna Th1-Th9. Art. Sternoclavicularis. Art. Acromioclavicularis;Costae 1-9 lateralt på bålen;Margo medialis scapulae;Abduktion av scapulae. Depression av scapulae (nedre delen). Depression av skuldran (nedre delen). Utåtrotation av scapulae (nedre delen). Stabiliserar scapulae mot thoraxväggen tillsammans med Mm. Rhomboideii (den muskeln måste nämnas vid tentamen!). Accessorisk andningsmuskel vid inspiration. Elevation av scapulae (övre delen). Inåtrotation av scapulae (övre delen).;;;;C5-C8 N. Thoracicus longus Pl.Brachialis.;"Svaghet eller skada på nerven kan ge alata eller ""vingscapulae"". Triggerpunkter ger smärtor i sidan av bröstkorgen (inte helt olik de vid angina pectoris (kärlkramp)";images/muscles/serratus_anterior.png
22;M. Intercostalis externus;;;;;Höjer revbenen. Accessorisk inspirationsmuskel.;;;;Th1-Th11(12) Nn. Intercostalis;Ursprung och fästen inom thorax. ;
23;M. Intercostalis internus;;;;;Sänker revbenen. Accessorisk expirationsmuskel;;;;Th1-Th11(12) Nn. Intercostalis;Mellan samtliga revben och löper snett nedåt;
24;M. Levatores costarium;;;Processus transversus Th1-Th12.;Costa 2-12 mellan tuberculum costa och angulus costa.;Höjer revbenen. Accessorisk inspirationsmuskel.;;;;Th1-Th11 Nn. Intercostalis.;;
25;M. Subcostales;;;;;Sänker revbenen. Accessorisk expirationsmuskel;;;;Th1-Th11 Nn. Intercostalis.;Endast dorsala delen och kan ses som en fortsättning på Mm. Intercostalis internus.;
26;M. Transversum thoracis;;;;;Sänker revbenen. Accessorisk expirationsmuskel;;;;Th1-Th8 Nn. Intercostalis;Triggerpunkter i muskeln kan ge radierande smärta längs med revbenen.;
27;M. Diaphragma;<li>Pars costalis</li><li>Pars lumbalis</li><li>Pars sternalis</li>;;Pars costalis:<br>Insidan av costa 6-12 lateralt (största delen).<br><br>Pars lumbalis:<br>Via crus dextrum och crus sinistrum anteriort på corpus vertebrae L1-L4<br><br>Pars sternalis:<br>Processus xiphoideus.;Centrum tendineum;Tryckförändring i lungsäcken, Inandning;;;;C3-C5 N. Phrenicus Pl. Cervicalis;Penetreras av: Aorta - I hiatus aorticum i höjd med Th8. Esophagus - I hiatus esophagus i höjd med Th10. V. Cava inferior - I foramen vena cava i höjd med Th12. För att sluta tätt runt musklerna finns kraftiga ligament som ligger i bågar runt musklerna och bildar arkader. Lig. arcuatum mediale sluter tätt runt M. Psoas major och bildar psoasarkaden. Lig. arcuatum laterale sluter tätt kring M. Quadratus lumborum och bildar Quadratusarkaden;images/muscles/diaphragma.png
28;M. Rectus abdominis;;Intervertebralleder i nedre bröst och ländrygg;Ventralt costa 5-7. Sternum och processus xiphoideus;Os pubis medialt;;;;Flexion av bålen. Tippar bålen bakåt. Minskar lordosen i ländryggen. Ökar det intraabdominala trycket. Minskar trycket på diskarna i ländryggen. Accessorisk andningsmuskel vid expiration;Th7-Th12 Nn. Intercostales;Innesluten i rectusskidan, som bildas av de övriga bukmusklernas fästesaponeuroser. De löper från dorsalsidan av bålen hela vägen fram till linea alba. Triggerpunkter i nedre del kan ge dysmennoré och förstärkt mensvärk hos kvinnor. Aktiva triggerpunkter kan även ge illamående och en känsla av att magen är uppsvälld.;images/muscles/rectus_abdominis.png
29;M. Pyramidalis;;;Os pubis mest mediala del;Linea alba ca. 5-10 cm ovan symfysen;Spänner upp linea alba.;;;;Nn. Intercostales;;
30;M. Obliquus externus abdominis;;Intervertebrallederna i nedre bröstrygg, ländryggen;Costae 5-12 ventralt-lateralt;Crista iliaca (labium externum). Lig. Inguinale. Linea alba/rectusskidan. Os pubis.;;;Lateralflexion av bålen. Kontralateral rotation av bålen.;Flexion av bålen. Tippar pelvis bakåt. Minskar lordosen i ländryggen. Ökar det intraabdominala trycket. Minskar trycket på diskarna i ländryggen. Accesorisk andningsmuskel vid expiration.;Th(5-6)7-Th12 Nn. Intercostalis. L1 N. Ilioinguinalis Pl. Lumbalis. L1 N. Iliohypogastricus Pl. Lumbalis.;Bålens starkaste rotatorer och lateralflexorer beroende på att muskeln är långt ifrån rörelsecentrum. Mindre vanliga triggerpunkter kan ge diarré och kräkningar.;images/muscles/obl_ext_abdominis.png
31;M. Obliquus internus abdominis;;Intervertebralleder i nedre bröst- och ländrygg;Crista iliaca (linea intermedia). Lig. Inguinale. Fascia transversalis.  ;Linea alba/rectusskidan. Costa 9-12 lateralt.;;;Lateralflexion av bålen. Ipsilateral rotation av bålen.;Flexion av bålen. Tippar pelvis bakåt. minskar lordosen i ländryggen. Ökar det intraabdominala trycket. Minskar trycket på diskarna i ländryggen. Accesorisk andningsmuskel vid expiration.;Th7-Th12 Nn. Intercostales. L1 N. Ilioinguinalis Pl. Lumbalis. L1 N. Iliohypogastricus Pl. Lumbalis.;Triggerpunkter  i muskeln kan ge smärtor till ljumske och testikel. Mindre vanliga triggerpunkter kan ge diarré och kräkningar.;images/muscles/obl_int_abdominis.png
32;M. Transversus abdominis;;Ingen större påverkan på ländryggens intevertebralleder.;Via fascia transveralis på processus costarius L1-L5. Insidan på costae 6-12. Laterala 2/3-delarna av crista iliaca labium internum. Lig. Inguinale.;Internusaponeurosen samt linea alba.;Ökar det intraabdominala trycket.;;;;Th7-Th12 Nn. Intercostalis. L1 N. Ilioinguinalis Pl. Lumbalis. L1 N. Iliohypogastricus Pl. Lumbalis.;Triggerpunkter ger smärtor till området runt solar plexus.;images/muscles/transversus_abdominis.png
33;M. Quadratus lumborum;<li>Pars iliocostalis</li><li>Pars iliolumbale</li><li>Pars lumbocostale</li>;Intervertebrallederna L1-L5. Costovertebralled 12.;Pars iliocostalis:<br>Crista iliaca labium internus. Lig. Iliolumbale.<br><br>Pars iliolumbale:<br>Crista iliaca labium internum. Lig. Iliolumbale.<br><br>Pars lumbocostale:<br>Processus costarius L1-L5.;Pars iliocostalis:<br>Costa 12 mediala 1/2.<br><br>Pars iliolumbale:<br>Processus costarius L1-L5.<br><br>Pars lumbocostale:<br>Costa 12 mediala 1/2;;;Lateralflexion av bålen. Ipsilateral rotation av ländrygg/bål.;Extention av bålen. Ökar lordosen i ländryggen. Tippar pelvis framåt. Accessorisk andningsmuskel (vid expiration). Kompression av ländrygg.;Th12 Nn. Intercostalis. L1-L3 Pl. Lumbalis.;inblandad i akuta smärttillstånd i ländryggen farmförallt vid djupa inandningar. Ska även korrigera för en eventuell benlängdsskillnad, vilket kan göra att muskeln spänner sig statiskt under långa perioder.;images/muscles/quadratus_lumborum.png
34;M. Levator Ani = M. Pubococcygeus;;;Os pubis dorsala yta;Os sacrum, os coccygis;;;;;N. Pudendus S3-4;;
35;M. Levator Ani = M. Iliococcygeus;;;Delar av os pubis dorsala yta samt os ilium;Os sacrum, os coccygis;;;;;N. Pudendus S3-4;;
36;M. Levator Ani = M. Coccygeus;;;Spina ischiadica;Os sacrums nedre del samt os coccygis;;;;;Pl. Sacralis S4-5;;
37;M. Sternocleido mastoideus;<li>Pars sternalis</li><li>Pars clavicularis</li>;Intervertebralleder C0-C7;Pars sternalis:<br>Manubrium sterni.<br><br>Pars clavicularis:<br>Claviculaes mediala del.;Processus mastoideus. Linea nuchae superior.;;;Kontralateral rotation av halsrygg och huvud. Lateralflexion av halsrygg och huvud.;Flexion av nedre halsryggen C3-C7. Extention av övre halsryggen samt huvudet C0-C2. Accessorisk andningsmuskel vid inspiration.;C(1)2-C3 Pl. Cervicales N. Accesorius XI.;"Vid förkortning påverkas hållningen genom att dra huvudet framåt i så kallad ""gamnackeposition"". Triggerpunkter i muskeln kan ge huvudvärk lokaliserad till ansiktet och hjässan.";
38;Mm. Scalenii;;;;;;;;;;;
39;M. Scalenus anterior;;Intervertebrallederna i halsryggen;Processus transversus (tuberculum anteriora) C3-C6;Costae 1 (tuberculi M. Scaleni anterioris).;;;Lateralflexion av halsryggen. Kontralateral rotation av halsryggen.;Flexion av halsryggen. Accessorisk andningsmuskel vid inspiration. Kompression av halsryggen.;C3-C4 Pl. Cervicalis. C5-C6 Pl. Brachialis.;Bildar tillsammans med M. Sternocleidomastoideus den främre scalenusluckan. Triggerpunkter i muskeln kan ge smärta, värk och domningar på underarmens och handens radiala sida.;
40;M. Scalenus medius;;Intervertebralleder C2-C7;Processus transversus (tuberculum posteriora) C2-C7.;Costae 1, membrana intercostalis 1.;;;Lateralflexion av halsryggen.;Lätt flexion av halsryggen. Accessorisk andningsmuskel vid inspiration. Kompression av halsryggen.;C3-C4 Pl. Cervicalis. C5-C8 Pl. Brachialis.;Bildar tillsammans med M. Scalenus anterior den bakre scalenusluckan. Triggerpunkt i muskeln kan ge upphov till smärta i axeln och armen samt stickningar i händer och fingrar.;
41;M. Scalenus posterior;;Intervertebralleder C5-C7;Processus transversus (tuberculum posteriora) C5-C7;Costae 2.;;;Lateralflexion av halsryggen. Ipsilateral rotation av halsryggen.;Extention av halsryggen. Accessorisk andningsmuskel vid inspiration. Kompression av halsryggen.;C5-C8 Pl. Brachialis;Triggerpunkter i muskeln kan ge smärtor i axeln och armen samt ge stickningar och domningar i hand och fingrar.;
42;M. Scalenus minimus;;Intervertebralleder C6-C7.;Processus transversus (tuberculum anteriora) C6-C7;Costae 1;;;Lateralflexion av halsryggen. Lätt kontralateral rotation av halsrygg.;Accessorisk andningsmuskel vid inspiration. Kompression av halsryggen.;C6-C8 Pl. Brachialis;Förekommer inte hos alla människor.;
43;Mm. Suprahyoideii;;;;;;;;;;;
44;M. Digastricus venter posterior;;;Fossa digastrica;Os hyoideum;Höjer os hyoideum. Sänker mandibulae.;;;;N. Facialis (VII);Muskeln består av två bukar, venter anterior och venter posterior.;
45;M. Digastricus venter anterior;;;Incisura mastoideus;Os hyoideum;Höjer os hyoideum. Sänker mandibulae.;;;;N. Trigeminus (V) nedersta gren. N. Mandibulae.;;
46;M. Stylohyoideus;;;Processus styloideus;Os hyoideum;Höjer os hyoideum.;;;;N. Facialis (VII);;
47;M. Mylohyoideus;;;Linea mylohyoidea mandibulae.;Os hyoideum.;Höjer os hyoideum. Sänker mandibulae.;;;;N. Trigeminus (V) nedersta gren. N. Mandibulae.;;
48;M. Geniohyoideus;;;Spina mentalis mandibulae;Os hyoideum.;Höjer os hyoideum. Sänker mandibulae.;;;;N. Hypoglossus (XII);;
49;Mm. Infrahyoideii;;;;;;;;;;Samtliga muskler hjälper  till vid sväljfunktionen och kan vid ett fixerat os hyoideum hjälpa till vid flexion av halsryggraden.;
50;M. Sternohyoideus;;;Dorsalt cartilago costa 1. Dorsalt manubrium sterni.;Os hyoideum.;Sänker os hyoideum.;;;;C1-C3 Ansa cervicalis.;;
51;M. Omohyoideus;;;Margo superior scapulae.;Os hyoideum.;Sänker os hyoideum.;;;;C1-C3 Ansa cervicalis.;;
52;M. Sternothyroideus;;;Manubrium sterni posteriort.;Cartilago thyroidea.;Sänker os hyoideu via M. Thyreohyodeus;;;;C1-C3 Ansa cervicalis.;;
53;M. Thyreohyoideus;;;Cartilago thyroidea;Os hyoideum.;Sänker os hyoideum.;;;;C1-C3 Ansa cervicalis.;;
54;Prevertebral muskulatur;;;;;Flexion av halsryggraden. Ipsilateralrotation av halsryggraden. Lateralflexion av halsryggraden.;;;;C1-C4 Pl. Cervicalis. C5-C8 Pl. Brachialis;;
55;M. Rectus capitis anterior;;;Massa lateralis atlantis;Anteriort om condylus occipitalis.;;;;;;;
56;M. Longus colli;;;;;;;;;;;
